{
  "schema_version": "1.0",
  "id": "hl-monitor-2026-08-30T0814Z",
  "kind": "routine",
  "produced_at": "2026-08-30T08:14:55Z",
  "asof_data": "2026-08-30",
  "producer": {
    "name": "hyperliquid-monitor",
    "agent_role": "crowding-monitor",
    "run_url": "https://github.com/Edwardwang66/stock-analysis/actions/runs/33301103341"
  },
  "alerts": [
    {
      "level": "warning",
      "code": "crypto-crowding",
      "message": "加密持仓面拥挤:多头资金费占比 0.947,OI 变化 -0.0149(§7.2 尾部风险信号,先于人群减杠杆 R7)。",
      "tickers": []
    },
    {
      "level": "info",
      "code": "funding-extreme",
      "message": "CASHCAT 资金费年化 169%(OI $37M)——挤压/单边持仓信号。",
      "tickers": [
        "CASHCAT"
      ]
    },
    {
      "level": "info",
      "code": "funding-extreme",
      "message": "XMR 资金费年化 66%(OI $74M)——挤压/单边持仓信号。",
      "tickers": [
        "XMR"
      ]
    },
    {
      "level": "info",
      "code": "afterhours-proxy",
      "message": "24/7 美股代理:SP500 永续 24h -0.01% (mark 7719.2,$20M/日)——盘后/周末缺口参考。",
      "tickers": []
    }
  ],
  "contribution": {
    "type": "regime_update",
    "summary": "HL 衍生品情报:19 流动永续持仓面,跨所错位 35,HIP-3 24/7 资产 100。"
  },
  "notes": "数据源 Hyperliquid 公开 info 接口;HIP-3 永续价为 mark 价,仅作参考,非证券报价。",
  "signature": {
    "alg": "HMAC-SHA256",
    "key_id": "default",
    "value": "5589c90fb96471ab4260bd0a410a2bc9319ccaf77e48f26e46ed23e250f42d5e"
  }
}
