{
  "schema_version": "1.0",
  "id": "hl-monitor-2026-06-24T0948Z",
  "kind": "routine",
  "produced_at": "2026-06-24T09:48:24Z",
  "asof_data": "2026-06-24",
  "producer": {
    "name": "hyperliquid-monitor",
    "agent_role": "crowding-monitor",
    "run_url": "https://github.com/Edwardwang66/stock-analysis/actions/runs/28089965570"
  },
  "alerts": [
    {
      "level": "info",
      "code": "afterhours-proxy",
      "message": "24/7 美股代理:SP500 永续 24h +0.06% (mark 7377.2,$360M/日)——盘后/周末缺口参考。",
      "tickers": []
    }
  ],
  "contribution": {
    "type": "regime_update",
    "summary": "HL 衍生品情报:23 流动永续持仓面,跨所错位 75,HIP-3 24/7 资产 84。"
  },
  "notes": "数据源 Hyperliquid 公开 info 接口;HIP-3 永续价为 mark 价,仅作参考,非证券报价。",
  "signature": {
    "alg": "HMAC-SHA256",
    "key_id": "default",
    "value": "da222cb1c054d7b22fd361cc43c3f98f1bcc061ba9311d8c7a640ce210aef250"
  }
}
